{
  "schema": "cloudx.upgrade.v1",
  "status": "upgraded",
  "endpoint": "local",
  "currentBefore": "0.1.25",
  "available": "0.1.26",
  "currentAfter": "0.1.26",
  "artifactRef": "refs/heads/release-artifacts/v0.1.26",
  "manifestSha256": "aaaaaaaaaaaaaaaaaaaaaaaaaaaaaaaaaaaaaaaaaaaaaaaaaaaaaaaaaaaaaaaa",
  "stageStatus": "staged",
  "activationStatus": "active",
  "signedIndexVerified": true,
  "verificationScope": "complete-release-chain",
  "explicitInvocation": true,
  "backgroundActivation": false,
  "serviceRestarted": false,
  "externalCpaManaged": false,
  "officialCodexReplaced": false,
  "shellReloadRecommended": true
}
